{"$comment":"{\"controlledPath\":\"governance/wave-1/match-setup/v1.0.0/W1_MATCH_FORMAT_DEFINITION_SCHEMA.json\",\"effectivityRule\":\"Effective for W1 DEVELOPMENT / CONFORMANCE at the verified Owner-authorised atomic publication revision; no invented date or containing hash\",\"identifier\":\"urn:amharc:w1:match-format-definition-schema:1.0.0\",\"implementationAuthorisation\":\"NONE conveyed by this specification or its publication\",\"operationalApplicability\":\"NOT established by publication; exact real format, issuer/allocator, principal/grant, policy and deployment applicability required before corresponding real use\",\"statusRule\":\"Controlled specification on competent Owner-authorised verified publication; candidate before that event\",\"title\":\"W1 Match Format Definition — v1.0.0\",\"version\":\"1.0.0\"}","$defs":{"exactReference":{"additionalProperties":false,"properties":{"id":{"maxLength":512,"minLength":1,"type":"string"},"sha256":{"pattern":"^[0-9a-f]{64}$","type":"string"},"version":{"maxLength":64,"pattern":"^[0-9]+\\.[0-9]+\\.[0-9]+$","type":"string"}},"required":["id","version","sha256"],"type":"object"}},"$id":"urn:amharc:w1:match-format-definition-schema:1.0.0","$schema":"https://json-schema.org/draft/2020-12/schema","additionalProperties":false,"oneOf":[{"properties":{"catalogueFamily":{"const":"official-h2-30-no-et"},"extraTime":{"const":{"applicability":"NOT_APPLICABLE","entryCondition":null}},"matchContext":{"const":"OFFICIAL_COMPETITIVE"},"periods":{"const":[{"key":"half-1","nominalDurationSeconds":1800,"phaseOrdinal":1,"semanticType":"REGULATION_HALF","sportingPhase":"REGULATION","successors":[{"condition":"ALWAYS","nextPeriodKey":"half-2","operation":"NEXT_PERIOD"}]},{"key":"half-2","nominalDurationSeconds":1800,"phaseOrdinal":2,"semanticType":"REGULATION_HALF","sportingPhase":"REGULATION","successors":[{"condition":"ALWAYS","nextPeriodKey":null,"operation":"COMPLETE"}]}]}},"required":["catalogueFamily","matchContext","periods","extraTime"]},{"properties":{"catalogueFamily":{"const":"official-h2-30-et2-10"},"extraTime":{"const":{"applicability":"CONDITIONAL","entryCondition":"EXACT_APPLICABLE_DECISION"}},"matchContext":{"const":"OFFICIAL_COMPETITIVE"},"periods":{"const":[{"key":"half-1","nominalDurationSeconds":1800,"phaseOrdinal":1,"semanticType":"REGULATION_HALF","sportingPhase":"REGULATION","successors":[{"condition":"ALWAYS","nextPeriodKey":"half-2","operation":"NEXT_PERIOD"}]},{"key":"half-2","nominalDurationSeconds":1800,"phaseOrdinal":2,"semanticType":"REGULATION_HALF","sportingPhase":"REGULATION","successors":[{"condition":"EXTRA_TIME_INVOKED","nextPeriodKey":"extra-time-half-1","operation":"NEXT_PERIOD"},{"condition":"EXTRA_TIME_NOT_INVOKED","nextPeriodKey":null,"operation":"COMPLETE"}]},{"key":"extra-time-half-1","nominalDurationSeconds":600,"phaseOrdinal":1,"semanticType":"EXTRA_TIME_HALF","sportingPhase":"EXTRA_TIME","successors":[{"condition":"ALWAYS","nextPeriodKey":"extra-time-half-2","operation":"NEXT_PERIOD"}]},{"key":"extra-time-half-2","nominalDurationSeconds":600,"phaseOrdinal":2,"semanticType":"EXTRA_TIME_HALF","sportingPhase":"EXTRA_TIME","successors":[{"condition":"ALWAYS","nextPeriodKey":null,"operation":"COMPLETE"}]}]}},"required":["catalogueFamily","matchContext","periods","extraTime"]},{"properties":{"catalogueFamily":{"const":"official-h2-30-et2-15"},"extraTime":{"const":{"applicability":"CONDITIONAL","entryCondition":"EXACT_APPLICABLE_DECISION"}},"matchContext":{"const":"OFFICIAL_COMPETITIVE"},"periods":{"const":[{"key":"half-1","nominalDurationSeconds":1800,"phaseOrdinal":1,"semanticType":"REGULATION_HALF","sportingPhase":"REGULATION","successors":[{"condition":"ALWAYS","nextPeriodKey":"half-2","operation":"NEXT_PERIOD"}]},{"key":"half-2","nominalDurationSeconds":1800,"phaseOrdinal":2,"semanticType":"REGULATION_HALF","sportingPhase":"REGULATION","successors":[{"condition":"EXTRA_TIME_INVOKED","nextPeriodKey":"extra-time-half-1","operation":"NEXT_PERIOD"},{"condition":"EXTRA_TIME_NOT_INVOKED","nextPeriodKey":null,"operation":"COMPLETE"}]},{"key":"extra-time-half-1","nominalDurationSeconds":900,"phaseOrdinal":1,"semanticType":"EXTRA_TIME_HALF","sportingPhase":"EXTRA_TIME","successors":[{"condition":"ALWAYS","nextPeriodKey":"extra-time-half-2","operation":"NEXT_PERIOD"}]},{"key":"extra-time-half-2","nominalDurationSeconds":900,"phaseOrdinal":2,"semanticType":"EXTRA_TIME_HALF","sportingPhase":"EXTRA_TIME","successors":[{"condition":"ALWAYS","nextPeriodKey":null,"operation":"COMPLETE"}]}]}},"required":["catalogueFamily","matchContext","periods","extraTime"]},{"properties":{"catalogueFamily":{"const":"official-h2-35-no-et"},"extraTime":{"const":{"applicability":"NOT_APPLICABLE","entryCondition":null}},"matchContext":{"const":"OFFICIAL_COMPETITIVE"},"periods":{"const":[{"key":"half-1","nominalDurationSeconds":2100,"phaseOrdinal":1,"semanticType":"REGULATION_HALF","sportingPhase":"REGULATION","successors":[{"condition":"ALWAYS","nextPeriodKey":"half-2","operation":"NEXT_PERIOD"}]},{"key":"half-2","nominalDurationSeconds":2100,"phaseOrdinal":2,"semanticType":"REGULATION_HALF","sportingPhase":"REGULATION","successors":[{"condition":"ALWAYS","nextPeriodKey":null,"operation":"COMPLETE"}]}]}},"required":["catalogueFamily","matchContext","periods","extraTime"]},{"properties":{"catalogueFamily":{"const":"official-h2-35-et2-10"},"extraTime":{"const":{"applicability":"CONDITIONAL","entryCondition":"EXACT_APPLICABLE_DECISION"}},"matchContext":{"const":"OFFICIAL_COMPETITIVE"},"periods":{"const":[{"key":"half-1","nominalDurationSeconds":2100,"phaseOrdinal":1,"semanticType":"REGULATION_HALF","sportingPhase":"REGULATION","successors":[{"condition":"ALWAYS","nextPeriodKey":"half-2","operation":"NEXT_PERIOD"}]},{"key":"half-2","nominalDurationSeconds":2100,"phaseOrdinal":2,"semanticType":"REGULATION_HALF","sportingPhase":"REGULATION","successors":[{"condition":"EXTRA_TIME_INVOKED","nextPeriodKey":"extra-time-half-1","operation":"NEXT_PERIOD"},{"condition":"EXTRA_TIME_NOT_INVOKED","nextPeriodKey":null,"operation":"COMPLETE"}]},{"key":"extra-time-half-1","nominalDurationSeconds":600,"phaseOrdinal":1,"semanticType":"EXTRA_TIME_HALF","sportingPhase":"EXTRA_TIME","successors":[{"condition":"ALWAYS","nextPeriodKey":"extra-time-half-2","operation":"NEXT_PERIOD"}]},{"key":"extra-time-half-2","nominalDurationSeconds":600,"phaseOrdinal":2,"semanticType":"EXTRA_TIME_HALF","sportingPhase":"EXTRA_TIME","successors":[{"condition":"ALWAYS","nextPeriodKey":null,"operation":"COMPLETE"}]}]}},"required":["catalogueFamily","matchContext","periods","extraTime"]},{"properties":{"catalogueFamily":{"const":"official-h2-35-et2-15"},"extraTime":{"const":{"applicability":"CONDITIONAL","entryCondition":"EXACT_APPLICABLE_DECISION"}},"matchContext":{"const":"OFFICIAL_COMPETITIVE"},"periods":{"const":[{"key":"half-1","nominalDurationSeconds":2100,"phaseOrdinal":1,"semanticType":"REGULATION_HALF","sportingPhase":"REGULATION","successors":[{"condition":"ALWAYS","nextPeriodKey":"half-2","operation":"NEXT_PERIOD"}]},{"key":"half-2","nominalDurationSeconds":2100,"phaseOrdinal":2,"semanticType":"REGULATION_HALF","sportingPhase":"REGULATION","successors":[{"condition":"EXTRA_TIME_INVOKED","nextPeriodKey":"extra-time-half-1","operation":"NEXT_PERIOD"},{"condition":"EXTRA_TIME_NOT_INVOKED","nextPeriodKey":null,"operation":"COMPLETE"}]},{"key":"extra-time-half-1","nominalDurationSeconds":900,"phaseOrdinal":1,"semanticType":"EXTRA_TIME_HALF","sportingPhase":"EXTRA_TIME","successors":[{"condition":"ALWAYS","nextPeriodKey":"extra-time-half-2","operation":"NEXT_PERIOD"}]},{"key":"extra-time-half-2","nominalDurationSeconds":900,"phaseOrdinal":2,"semanticType":"EXTRA_TIME_HALF","sportingPhase":"EXTRA_TIME","successors":[{"condition":"ALWAYS","nextPeriodKey":null,"operation":"COMPLETE"}]}]}},"required":["catalogueFamily","matchContext","periods","extraTime"]},{"properties":{"catalogueFamily":{"const":"training-h2-30"},"extraTime":{"const":{"applicability":"NOT_APPLICABLE","entryCondition":null}},"matchContext":{"const":"CHALLENGE_FRIENDLY_TRAINING"},"periods":{"const":[{"key":"half-1","nominalDurationSeconds":1800,"phaseOrdinal":1,"semanticType":"REGULATION_HALF","sportingPhase":"REGULATION","successors":[{"condition":"ALWAYS","nextPeriodKey":"half-2","operation":"NEXT_PERIOD"}]},{"key":"half-2","nominalDurationSeconds":1800,"phaseOrdinal":2,"semanticType":"REGULATION_HALF","sportingPhase":"REGULATION","successors":[{"condition":"ALWAYS","nextPeriodKey":null,"operation":"COMPLETE"}]}]}},"required":["catalogueFamily","matchContext","periods","extraTime"]},{"properties":{"catalogueFamily":{"const":"training-h2-35"},"extraTime":{"const":{"applicability":"NOT_APPLICABLE","entryCondition":null}},"matchContext":{"const":"CHALLENGE_FRIENDLY_TRAINING"},"periods":{"const":[{"key":"half-1","nominalDurationSeconds":2100,"phaseOrdinal":1,"semanticType":"REGULATION_HALF","sportingPhase":"REGULATION","successors":[{"condition":"ALWAYS","nextPeriodKey":"half-2","operation":"NEXT_PERIOD"}]},{"key":"half-2","nominalDurationSeconds":2100,"phaseOrdinal":2,"semanticType":"REGULATION_HALF","sportingPhase":"REGULATION","successors":[{"condition":"ALWAYS","nextPeriodKey":null,"operation":"COMPLETE"}]}]}},"required":["catalogueFamily","matchContext","periods","extraTime"]},{"properties":{"catalogueFamily":{"const":"training-q4-10"},"extraTime":{"const":{"applicability":"NOT_APPLICABLE","entryCondition":null}},"matchContext":{"const":"CHALLENGE_FRIENDLY_TRAINING"},"periods":{"const":[{"key":"quarter-1","nominalDurationSeconds":600,"phaseOrdinal":1,"semanticType":"REGULATION_QUARTER","sportingPhase":"REGULATION","successors":[{"condition":"ALWAYS","nextPeriodKey":"quarter-2","operation":"NEXT_PERIOD"}]},{"key":"quarter-2","nominalDurationSeconds":600,"phaseOrdinal":2,"semanticType":"REGULATION_QUARTER","sportingPhase":"REGULATION","successors":[{"condition":"ALWAYS","nextPeriodKey":"quarter-3","operation":"NEXT_PERIOD"}]},{"key":"quarter-3","nominalDurationSeconds":600,"phaseOrdinal":3,"semanticType":"REGULATION_QUARTER","sportingPhase":"REGULATION","successors":[{"condition":"ALWAYS","nextPeriodKey":"quarter-4","operation":"NEXT_PERIOD"}]},{"key":"quarter-4","nominalDurationSeconds":600,"phaseOrdinal":4,"semanticType":"REGULATION_QUARTER","sportingPhase":"REGULATION","successors":[{"condition":"ALWAYS","nextPeriodKey":null,"operation":"COMPLETE"}]}]}},"required":["catalogueFamily","matchContext","periods","extraTime"]},{"properties":{"catalogueFamily":{"const":"training-q4-15"},"extraTime":{"const":{"applicability":"NOT_APPLICABLE","entryCondition":null}},"matchContext":{"const":"CHALLENGE_FRIENDLY_TRAINING"},"periods":{"const":[{"key":"quarter-1","nominalDurationSeconds":900,"phaseOrdinal":1,"semanticType":"REGULATION_QUARTER","sportingPhase":"REGULATION","successors":[{"condition":"ALWAYS","nextPeriodKey":"quarter-2","operation":"NEXT_PERIOD"}]},{"key":"quarter-2","nominalDurationSeconds":900,"phaseOrdinal":2,"semanticType":"REGULATION_QUARTER","sportingPhase":"REGULATION","successors":[{"condition":"ALWAYS","nextPeriodKey":"quarter-3","operation":"NEXT_PERIOD"}]},{"key":"quarter-3","nominalDurationSeconds":900,"phaseOrdinal":3,"semanticType":"REGULATION_QUARTER","sportingPhase":"REGULATION","successors":[{"condition":"ALWAYS","nextPeriodKey":"quarter-4","operation":"NEXT_PERIOD"}]},{"key":"quarter-4","nominalDurationSeconds":900,"phaseOrdinal":4,"semanticType":"REGULATION_QUARTER","sportingPhase":"REGULATION","successors":[{"condition":"ALWAYS","nextPeriodKey":null,"operation":"COMPLETE"}]}]}},"required":["catalogueFamily","matchContext","periods","extraTime"]},{"properties":{"catalogueFamily":{"const":"training-q4-20"},"extraTime":{"const":{"applicability":"NOT_APPLICABLE","entryCondition":null}},"matchContext":{"const":"CHALLENGE_FRIENDLY_TRAINING"},"periods":{"const":[{"key":"quarter-1","nominalDurationSeconds":1200,"phaseOrdinal":1,"semanticType":"REGULATION_QUARTER","sportingPhase":"REGULATION","successors":[{"condition":"ALWAYS","nextPeriodKey":"quarter-2","operation":"NEXT_PERIOD"}]},{"key":"quarter-2","nominalDurationSeconds":1200,"phaseOrdinal":2,"semanticType":"REGULATION_QUARTER","sportingPhase":"REGULATION","successors":[{"condition":"ALWAYS","nextPeriodKey":"quarter-3","operation":"NEXT_PERIOD"}]},{"key":"quarter-3","nominalDurationSeconds":1200,"phaseOrdinal":3,"semanticType":"REGULATION_QUARTER","sportingPhase":"REGULATION","successors":[{"condition":"ALWAYS","nextPeriodKey":"quarter-4","operation":"NEXT_PERIOD"}]},{"key":"quarter-4","nominalDurationSeconds":1200,"phaseOrdinal":4,"semanticType":"REGULATION_QUARTER","sportingPhase":"REGULATION","successors":[{"condition":"ALWAYS","nextPeriodKey":null,"operation":"COMPLETE"}]}]}},"required":["catalogueFamily","matchContext","periods","extraTime"]}],"properties":{"catalogueFamily":{"enum":["official-h2-30-no-et","official-h2-30-et2-10","official-h2-30-et2-15","official-h2-35-no-et","official-h2-35-et2-10","official-h2-35-et2-15","training-h2-30","training-h2-35","training-q4-10","training-q4-15","training-q4-20"]},"code":{"enum":["GAELIC_FOOTBALL","HURLING"]},"definitionBasis":{"additionalProperties":false,"properties":{"applicationProfileRef":{"$ref":"#/$defs/exactReference"},"authoringActivityRef":{"$ref":"#/$defs/exactReference"}},"required":["authoringActivityRef","applicationProfileRef"],"type":"object"},"extraTime":{"additionalProperties":false,"properties":{"applicability":{"enum":["NOT_APPLICABLE","CONDITIONAL"]},"entryCondition":{"enum":[null,"EXACT_APPLICABLE_DECISION"]}},"required":["applicability","entryCondition"],"type":"object"},"identifier":{"maxLength":512,"minLength":1,"type":"string"},"matchContext":{"enum":["OFFICIAL_COMPETITIVE","CHALLENGE_FRIENDLY_TRAINING"]},"periods":{"maxItems":4,"minItems":2,"type":"array"},"sport":{"const":"GAELIC_GAMES"},"standing":{"enum":["TEST_ONLY","PROPOSED","PUBLISHED_DEFINITION"]},"version":{"const":"1.0.0"}},"required":["identifier","version","standing","sport","code","catalogueFamily","matchContext","periods","extraTime","definitionBasis"],"title":"W1 Match Format Definition — v1.0.0","type":"object"}