{"catalogueFamily":"official-h2-30-no-et","code":"GAELIC_FOOTBALL","definitionBasis":{"applicationProfileRef":{"id":"urn:amharc:w1:match-format-application:1.0.0","sha256":"1e6c8642bbc8b6856be256a07c5ed6ea9aabb23a14284a80fc2870fcf416c218","version":"1.0.0"},"authoringActivityRef":{"id":"urn:amharc:test:w1-3a:authoring-activity:1.0.0","sha256":"6f266461739cc6c66d96360a02761d8f75291ff3fcbf6c98c981a2a6657e6ec0","version":"1.0.0"}},"extraTime":{"applicability":"NOT_APPLICABLE","entryCondition":null},"identifier":"urn:amharc:test:w1-3a:format:official-h2-30-no-et:1.0.0","matchContext":"OFFICIAL_COMPETITIVE","periods":[{"key":"half-1","nominalDurationSeconds":1800,"phaseOrdinal":1,"semanticType":"REGULATION_HALF","sportingPhase":"REGULATION","successors":[{"condition":"ALWAYS","nextPeriodKey":"half-2","operation":"NEXT_PERIOD"}]},{"key":"half-2","nominalDurationSeconds":1800,"phaseOrdinal":2,"semanticType":"REGULATION_HALF","sportingPhase":"REGULATION","successors":[{"condition":"ALWAYS","nextPeriodKey":null,"operation":"COMPLETE"}]}],"sport":"GAELIC_GAMES","standing":"TEST_ONLY","version":"1.0.0"}